Villa Rifka u Sarajevu__--__Sarajevo ima veliki broj prekrasnih vila koje su izgrađene za vrijeme Osmanlija ili Austro-Ugarske. One su od velikog kulturno-historijskog značaja za grad, a neke su još naseljene. Jedna od njih je i Villa Rifka na Bistriku.
Vila se sastoji od tri jednosobna, dva dvosobna i četiri trosobna stana. Nalazi se u ulici Za Beglukom. Nastala je za vrijeme Austro-Ugarske i nije renovirana te na njoj stoji znak upozorenja na moguće obrušavanje. Uknjižena je kao kulturni objekat koji se sastoji od kuće sa kućištem i dvorištem površine 634 metra kvadratna.
__--__http://static.klix.ba/media/images/vijesti/160520022.1_xl.jpg^^^^^^
Konačno sunčan dan u maju izmamio Sarajlije u šetnju, od utorka kiša__--__Nakon pretežno kišnog vremena od početka ovog mejseca, građani danas konačno mogu uživati u suncu i svim čarima proljeća.
Prohladno i kišovito vrijeme obilježilo je dosadašnji period mjeseca maja, čime se gubio osjećaj da nam kalendarski stiglo proljeće, jer građani još nisu mogli u potpunosti odložiti topliju odjeću.
__--__http://static.klix.ba/media/images/vijesti/160522048.11_xxl.jpg^^^^^^
ŠAĆIRBEGOVIĆ: 22. maj je historijski dan!__--__Generalna skupština Ujedinjenih naroda (UN) prije 24 godine primila je Republiku Bosnu i Hercegovinu među svoje članove. Ispred sjedišta UN-a na Ist Riveru u Njujorku tog dana zavihorila se bh. zastava s ljiljanima, čime je ozvaničen prijem naše zemlje u ovu najznačajniju svjetsku organizaciju.
Muhamed Šaćirbegović, nekadašnji ministar vanjskih poslova BiH i prvi ambasador BiH pri UN-u, u razgovoru za „Avaz“ kaže da je 22. maj jedan od najznačajnijih datuma u historiji naše zemlje. __--__http://www.avaz.ba/storage/2016/05/22/thumbs/57416583-0e88-4c73-8c03-7ba90a0a0a64-sacirbegovic-718x446.jpg^^^^^^